{
  "$schema": "https://json-schema.org/draft/2020-12/schema",
  "$id": "https://lecture-transcripts.local/protocol/transcript-job.schema.json",
  "title": "TranscriptJob",
  "$comment": "Runtime validation additionally enforces UTF-8 byte limits of 460800 per transcript field and 972800 for the canonical serialized job. contentHash is SHA-256 of the transcript-hash-v1 framed UTF-8 input defined in TECHNICAL_PLAN.md. displayTitle is display-only, single-line, at most 256 characters, and the empty string when the recording has no topic; it is never an identity field.",
  "type": "object",
  "additionalProperties": false,
  "properties": {
    "schemaVersion": { "const": 1 },
    "kind": { "type": "string", "enum": ["lecture", "discussion"] },
    "lectureKey": { "type": "string", "pattern": "^[a-z0-9]+/[0-9]{4}-(winter|spring|summer|fall)/[0-9]{3}$", "maxLength": 128 },
    "courseSlug": { "type": "string", "pattern": "^[a-z0-9]+$", "maxLength": 64 },
    "courseName": { "type": "string", "minLength": 1, "maxLength": 256 },
    "term": { "type": "string", "pattern": "^[0-9]{4}-(winter|spring|summer|fall)$", "maxLength": 32 },
    "lectureNumber": { "type": "integer", "minimum": 1, "maximum": 999 },
    "lectureDate": { "type": "string", "pattern": "^[0-9]{4}-[0-9]{2}-[0-9]{2}$", "maxLength": 10 },
    "displayTitle": { "type": "string", "maxLength": 256 },
    "sourceUrl": { "type": "string", "pattern": "^https://", "minLength": 1, "maxLength": 2048 },
    "capturedAt": { "type": "string", "pattern": "^[0-9]{4}-[0-9]{2}-[0-9]{2}T[0-9]{2}:[0-9]{2}:[0-9]{2}Z$", "maxLength": 20 },
    "transcript": { "type": "string", "minLength": 1, "maxLength": 460800 },
    "timestampedTranscript": { "type": "string", "maxLength": 460800 },
    "contentHash": { "type": "string", "pattern": "^[0-9a-f]{64}$", "maxLength": 64 }
  },
  "required": [
    "schemaVersion",
    "kind",
    "lectureKey",
    "courseSlug",
    "courseName",
    "term",
    "lectureNumber",
    "lectureDate",
    "displayTitle",
    "sourceUrl",
    "capturedAt",
    "transcript",
    "timestampedTranscript",
    "contentHash"
  ]
}
