{"schemaVersion":1,"kind":"lecture","lectureKey":"eecs484/2026-fall/001","courseSlug":"eecs484","courseName":"EECS 484","term":"2026-fall","lectureNumber":1,"lectureDate":"2026-09-01","displayTitle":"Intro, Smith","sourceUrl":"https://leccap.engin.umich.edu/leccap/player/r/sanitized01","capturedAt":"2026-09-20T12:34:56Z","transcript":"Can I ask you a question?\nI think we can start. Welcome to EECS 484.\nWe cover SQL, indexes & query plans.\nIf x < y, the plan uses a range scan.\nQ&A follows the lecture.","timestampedTranscript":"[00:00] Can I ask you a question?\n[00:02] I think we can start. Welcome to EECS 484.\nWe cover SQL, indexes & query plans.\nIf x < y, the plan uses a range scan.\n[1:22:58] Q&A follows the lecture.","contentHash":"f258b922005fbd9a94f3dae78f814a1e7a5573a4c4e3223900bf0e2d1749c423"}